{
  "$schema": "https://json-schema.org/draft/2020-12/schema",
  "$id": "https://aig-rlic-plus.local/schemas/evidence_status.schema.json",
  "x-owner": "evan",
  "x-version": "1.1.0",
  "title": "Evidence Status",
  "description": "Optional per-pair honesty label at `results/{pair_id}/evidence_status.json`. It tells dashboard consumers whether the currently displayed winner is merely the best rule found in a broad search, still needs a fresh confirmation test, or has passed that confirmation. Missing files default to `found_in_search` in the app.",
  "type": "object",
  "required": [
    "pair_id",
    "schema_version",
    "status",
    "updated_at"
  ],
  "properties": {
    "pair_id": {
      "type": "string",
      "pattern": "^[a-z0-9_]+$",
      "description": "Canonical pair identifier matching `results/{pair_id}`."
    },
    "schema_version": {
      "type": "string",
      "enum": [
        "1.0.0",
        "1.1.0",
        "1.2.0"
      ],
      "description": "Instance schema version. 1.1.0 adds the optional `final_exam` lineage block. 1.2.0 adds `failed_final_exam` status and `failure_reasons` array."
    },
    "status": {
      "type": "string",
      "enum": [
        "found_in_search",
        "needs_final_exam",
        "passed_final_exam",
        "failed_final_exam"
      ],
      "description": "`found_in_search` — winner selected from tournament, no confirmation test run. `needs_final_exam` — confirmation planned but not yet run. `passed_final_exam` — holdout/confirmation test run and passed. `failed_final_exam` — holdout/confirmation test was run but did not pass; exam results are documented and displayed to users as informational disclosure."
    },
    "updated_at": {
      "type": "string",
      "format": "date-time",
      "description": "ISO 8601 timestamp for the evidence-status decision."
    },
    "confirmation_test": {
      "type": "string",
      "description": "Name of the final-exam/confirmation method, when applicable."
    },
    "confirmation_window": {
      "type": "object",
      "properties": {
        "start": {
          "type": "string",
          "format": "date"
        },
        "end": {
          "type": "string",
          "format": "date"
        }
      },
      "additionalProperties": false
    },
    "plain_english": {
      "type": "string",
      "description": "Optional pair-specific plain-English wording. If omitted, the app uses canonical ELI5 copy for the status enum."
    },
    "technical_note": {
      "type": "string",
      "description": "Optional technical note documenting the statistical reason for the status."
    },
    "next_step": {
      "type": "string",
      "description": "Optional next action, especially for `found_in_search` or `needs_final_exam`."
    },
    "owner": {
      "type": "string",
      "description": "Agent or human who made the evidence-status decision."
    },
    "failure_reasons": {
      "type": "array",
      "items": { "type": "string" },
      "minItems": 1,
      "description": "Required when status is `failed_final_exam`. One entry per failed ECON-FE1 condition, in plain English. Displayed verbatim as a disclosure banner to portal users."
    },
    "final_exam": {
      "type": "object",
      "required": [
        "frozen_rule_id",
        "frozen_at",
        "search_window",
        "confirmation_window",
        "n_trials_raw",
        "n_trials_effective",
        "primary_metric",
        "thresholds_version",
        "result_artifact",
        "qa_status"
      ],
      "properties": {
        "frozen_rule_id": {
          "type": "string",
          "minLength": 1,
          "description": "Stable identifier for the frozen selected rule."
        },
        "frozen_at": {
          "type": "string",
          "format": "date-time",
          "description": "Timestamp at which the rule was frozen before confirmation."
        },
        "search_window": {
          "type": "object",
          "required": [
            "start",
            "end"
          ],
          "properties": {
            "start": {
              "type": "string",
              "format": "date"
            },
            "end": {
              "type": "string",
              "format": "date"
            }
          },
          "additionalProperties": false
        },
        "confirmation_window": {
          "type": "object",
          "required": [
            "start",
            "end",
            "n_obs"
          ],
          "properties": {
            "start": {
              "type": "string",
              "format": "date"
            },
            "end": {
              "type": "string",
              "format": "date"
            },
            "n_obs": {
              "type": "integer",
              "minimum": 1
            }
          },
          "additionalProperties": false
        },
        "n_trials_raw": {
          "type": "integer",
          "minimum": 1,
          "description": "Raw count of eligible tournament/search recipes."
        },
        "n_trials_effective": {
          "type": "integer",
          "minimum": 1,
          "description": "Effective number of independent recipes after collapsing highly correlated variants."
        },
        "primary_metric": {
          "type": "string",
          "enum": [
            "delta_sharpe",
            "excess_ann_return",
            "min_drawdown"
          ]
        },
        "thresholds_version": {
          "type": "string",
          "description": "Version tag for the final-exam pass/fail thresholds."
        },
        "result_artifact": {
          "type": "string",
          "pattern": "^results/[a-z0-9_]+/final_exam_results_[0-9]{8}\\.json$",
          "description": "Path to the companion final-exam results artifact."
        },
        "qa_status": {
          "type": "string",
          "enum": [
            "not_started",
            "pending_quincy",
            "qa_passed",
            "qa_failed"
          ]
        }
      },
      "additionalProperties": false
    }
  },
  "allOf": [
    {
      "if": {
        "properties": { "status": { "const": "passed_final_exam" } },
        "required": [ "status" ]
      },
      "then": {
        "required": [
          "confirmation_test",
          "confirmation_window",
          "technical_note",
          "owner",
          "final_exam"
        ],
        "properties": {
          "final_exam": {
            "properties": { "qa_status": { "const": "qa_passed" } },
            "required": [ "qa_status" ]
          }
        }
      }
    },
    {
      "if": {
        "properties": { "status": { "const": "failed_final_exam" } },
        "required": [ "status" ]
      },
      "then": {
        "required": [
          "confirmation_test",
          "confirmation_window",
          "technical_note",
          "plain_english",
          "failure_reasons",
          "owner",
          "final_exam"
        ],
        "properties": {
          "failure_reasons": {
            "minItems": 1
          },
          "final_exam": {
            "properties": { "qa_status": { "const": "qa_passed" } },
            "required": [ "qa_status" ]
          }
        }
      }
    }
  ],
  "additionalProperties": false
}
