{
  "pair_id": "consumer_sentiment_spy",
  "schema_version": "1.2.0",
  "status": "found_in_search",
  "updated_at": "2026-10-20T14:50:13.723243+00:00",
  "plain_english": "A winning rule was found in the search grid, but it has not passed a fresh final exam.",
  "technical_note": "Winner selected on in-sample data by the lead-plateau rule (D9) from the 20261020 tournament on real-time UMCSENT vintages and reported on the test window (seen by earlier runs, so not a frozen hold-out).",
  "next_step": "Freeze the selected rule and run a confirmation test on future data or a reserved holdout window.",
  "owner": "evan"
}
