{
  "pair_id": "sloos_ci_small_spy",
  "schema_version": "1.2.0",
  "status": "found_in_search",
  "updated_at": "2026-10-15T18:15:44.625772+00:00",
  "plain_english": "A winning rule was found in the search grid, but it has not passed a fresh final exam.",
  "technical_note": "Winner selected by in-sample Sharpe (common pre-OOS window) from the 20261015 quarterly tournament and evaluated on the held-out OOS window; SLOOS leads but the OOS window is small.",
  "next_step": "Freeze the selected rule and run a confirmation test on future data.",
  "owner": "evan"
}
