{
  "pair_id": "cement_spy",
  "schema_version": "1.2.0",
  "status": "found_in_search",
  "updated_at": "2026-10-18T11:32:12.222975+00:00",
  "plain_english": "A winning rule was found in the search grid, but it has not passed a fresh final exam.",
  "technical_note": "Winner selected on in-sample data by the lead-plateau rule (D9) from the 20261018 tournament on today's revised USGS cement values (no archive of first releases) with point-in-time release dates, reported on the test window (seen by earlier runs, so not a frozen hold-out).",
  "next_step": "Freeze the selected rule and run a confirmation test on future data or a reserved holdout window.",
  "owner": "evan"
}
